{
  "title": "Step 1: Create a Blank board",
  "description": "A simple agent that helps me find interesting books.",
  "version": "0.0.1",
  "metadata": {
    "comments": [
      {
        "id": "comment-75edf66c",
        "text": "Step 1: **Create a blank board**",
        "metadata": {
          "visual": {
            "x": -145,
            "y": -64,
            "collapsed": "expanded"
          }
        }
      }
    ],
    "tags": [],
    "visual": {}
  },
  "nodes": [
    {
      "type": "input",
      "id": "input",
      "configuration": {
        "schema": {
          "properties": {
            "context": {
              "type": "array",
              "title": "Context",
              "examples": [],
              "items": {
                "type": "object",
                "behavior": [
                  "llm-content"
                ]
              },
              "default": "[{\"role\":\"user\",\"parts\":[{\"text\":\"\"}]}]"
            }
          },
          "type": "object",
          "required": []
        }
      },
      "metadata": {
        "visual": {
          "x": -142,
          "y": -2,
          "collapsed": "expanded"
        }
      }
    },
    {
      "type": "output",
      "id": "output",
      "configuration": {
        "schema": {
          "properties": {
            "context": {
              "type": "array",
              "title": "Context",
              "examples": [],
              "items": {
                "type": "object",
                "behavior": [
                  "llm-content"
                ]
              },
              "default": "null"
            }
          },
          "type": "object",
          "required": []
        }
      },
      "metadata": {
        "visual": {
          "x": 173,
          "y": 0,
          "collapsed": "expanded"
        }
      }
    }
  ],
  "edges": [
    {
      "from": "input",
      "out": "context",
      "to": "output",
      "in": "context"
    }
  ]
}