{
  "title": "Endless Debate",
  "description": "A simple board that demonstrates how to create a conversation loop. It's a debate between a scientist named Albert and a philosopher named Friedrich. Albert is warm, funny, and inquisitve. Friedrich is  disagreeable, brooding, skeptical, and sarcastic.\nThis board goes on forever, so you'll have to reload or close the page (or press Ctrl+C in console) to end it. Note how over time, the conversation becomes more and more mechanical and predictable, with only a few variations in sentence patterns.",
  "version": "0.0.1",
  "edges": [
    {
      "from": "rememberQuestion",
      "to": "rememberAlbert",
      "out": "accumulator",
      "in": "accumulator"
    },
    {
      "from": "rememberAlbert",
      "to": "rememberFriedrich",
      "out": "accumulator",
      "in": "accumulator"
    },
    {
      "from": "rememberFriedrich",
      "to": "rememberAlbert",
      "out": "accumulator",
      "in": "accumulator"
    },
    {
      "from": "rememberAlbert",
      "to": "promptTemplate-2",
      "out": "accumulator",
      "in": "context"
    },
    {
      "from": "palm-generateText-3",
      "to": "rememberAlbert",
      "out": "completion",
      "in": "Albert"
    },
    {
      "from": "palm-generateText-3",
      "to": "albertSays",
      "out": "completion",
      "in": "text"
    },
    {
      "from": "secrets-1",
      "to": "palm-generateText-3",
      "constant": true,
      "out": "PALM_KEY",
      "in": "PALM_KEY"
    },
    {
      "from": "albert",
      "to": "palm-generateText-3",
      "out": "prompt",
      "in": "text"
    },
    {
      "from": "rememberFriedrich",
      "to": "albert",
      "out": "accumulator",
      "in": "context"
    },
    {
      "from": "palm-generateText-4",
      "to": "rememberFriedrich",
      "out": "completion",
      "in": "Friedrich"
    },
    {
      "from": "palm-generateText-4",
      "to": "friedrichSays",
      "out": "completion",
      "in": "text"
    },
    {
      "from": "secrets-1",
      "to": "palm-generateText-4",
      "constant": true,
      "out": "PALM_KEY",
      "in": "PALM_KEY"
    },
    {
      "from": "promptTemplate-2",
      "to": "palm-generateText-4",
      "out": "prompt",
      "in": "text"
    },
    {
      "from": "rememberQuestion",
      "to": "albert",
      "out": "accumulator",
      "in": "context"
    },
    {
      "from": "input-5",
      "to": "rememberQuestion",
      "out": "text",
      "in": "topic"
    }
  ],
  "nodes": [
    {
      "id": "rememberFriedrich",
      "type": "append"
    },
    {
      "id": "rememberAlbert",
      "type": "append"
    },
    {
      "id": "rememberQuestion",
      "type": "append"
    },
    {
      "id": "secrets-1",
      "type": "secrets",
      "configuration": {
        "keys": [
          "PALM_KEY"
        ]
      }
    },
    {
      "id": "promptTemplate-2",
      "type": "promptTemplate",
      "configuration": {
        "template": "Add a single argument to a debate between a philosopher named Friedrich and a scientist named Albert. You are Friedrich, and you are disagreeable, brooding, skeptical, sarcastic, yet passionate about uncovering new insights with Albert. To keep the debate rich and satisfying, you vary your sentence patterns and keep them from repeating.\n\n== Conversation Transcript\n{{context}}\n\n==Additional Single Argument\nFriedrich:"
      }
    },
    {
      "id": "albert",
      "type": "promptTemplate",
      "configuration": {
        "template": "Add a single argument to a debate between a scientist named Albert and a philosopher named Friedrich. You are Albert, and you are warm, funny, inquisitve, and passionate about uncovering new insights with Friedrich. To keep the debate rich and satisfying, you vary your sentence patterns and keep them from repeating.\"\n\n== Debate History\n{{context}}\n\n==Additional Single Argument\n\nAlbert:"
      }
    },
    {
      "id": "palm-generateText-3",
      "type": "palm-generateText",
      "configuration": {
        "stopSequences": [
          "\nFriedrich",
          "\n**Friedrich"
        ],
        "safetySettings": [
          {
            "category": "HARM_CATEGORY_DEROGATORY",
            "threshold": "BLOCK_ONLY_HIGH"
          },
          {
            "category": "HARM_CATEGORY_TOXICITY",
            "threshold": "BLOCK_ONLY_HIGH"
          }
        ]
      }
    },
    {
      "id": "albertSays",
      "type": "output",
      "configuration": {
        "schema": {
          "type": "object",
          "properties": {
            "text": {
              "type": "string",
              "title": "Albert",
              "description": "What Albert says"
            }
          },
          "required": [
            "text"
          ]
        }
      }
    },
    {
      "id": "palm-generateText-4",
      "type": "palm-generateText",
      "configuration": {
        "stopSequences": [
          "\nAlbert",
          "\n**Albert"
        ],
        "safetySettings": [
          {
            "category": "HARM_CATEGORY_DEROGATORY",
            "threshold": "BLOCK_ONLY_HIGH"
          },
          {
            "category": "HARM_CATEGORY_TOXICITY",
            "threshold": "BLOCK_ONLY_HIGH"
          }
        ]
      }
    },
    {
      "id": "friedrichSays",
      "type": "output",
      "configuration": {
        "schema": {
          "type": "object",
          "properties": {
            "text": {
              "type": "string",
              "title": "Friedrich",
              "description": "What Friedrich says"
            }
          },
          "required": [
            "text"
          ]
        }
      }
    },
    {
      "id": "input-5",
      "type": "input",
      "configuration": {
        "schema": {
          "type": "object",
          "properties": {
            "text": {
              "type": "string",
              "title": "Topic",
              "description": "What is the topic of the debate?"
            }
          },
          "required": [
            "text"
          ]
        }
      }
    }
  ],
  "kits": [
    {
      "url": "npm:@google-labs/llm-starter"
    },
    {
      "url": "npm:@google-labs/core-kit"
    },
    {
      "url": "npm:@google-labs/palm-kit"
    }
  ]
}