{
  "title": "Nager Date Country Info API",
  "description": "Get the country info for the Nager Date API",
  "version": "0.0.1",
  "edges": [
    {
      "from": "fetch",
      "to": "output",
      "out": "response",
      "in": "dates"
    },
    {
      "from": "query",
      "to": "urlTemplate",
      "out": "countryCode",
      "in": "countryCode"
    },
    {
      "from": "urlTemplate",
      "to": "fetch",
      "out": "url",
      "in": "url"
    }
  ],
  "nodes": [
    {
      "id": "query",
      "type": "input",
      "configuration": {
        "schema": {
          "type": "object",
          "properties": {
            "countryCode": {
              "type": "string",
              "title": "countryCode",
              "description": "The data for countryCode",
              "default": "US",
              "enum": [
                "AD",
                "AL",
                "AM",
                "AR",
                "AT",
                "AU",
                "AX",
                "BA",
                "BB",
                "BE",
                "BG",
                "BJ",
                "BO",
                "BR",
                "BS",
                "BW",
                "BY",
                "BZ",
                "CA",
                "CH",
                "CL",
                "CN",
                "CO",
                "CR",
                "CU",
                "CY",
                "CZ",
                "DE",
                "DK",
                "DO",
                "EC",
                "EE",
                "EG",
                "ES",
                "FI",
                "FO",
                "FR",
                "GA",
                "GB",
                "GD",
                "GE",
                "GG",
                "GI",
                "GL",
                "GM",
                "GR",
                "GT",
                "GY",
                "HK",
                "HN",
                "HR",
                "HT",
                "HU",
                "ID",
                "IE",
                "IL",
                "IM",
                "IN",
                "IS",
                "IT",
                "JE",
                "JM",
                "JP",
                "KE",
                "KG",
                "KH",
                "KR",
                "KW",
                "KZ",
                "LA",
                "LI",
                "LK",
                "LS",
                "LT",
                "LU",
                "LV",
                "MA",
                "MC",
                "MD",
                "ME",
                "MG",
                "MK",
                "MN",
                "MS",
                "MT",
                "MX",
                "MY",
                "MZ",
                "NA",
                "NE",
                "NG",
                "NI",
                "NL",
                "NO",
                "NZ",
                "PA",
                "PE",
                "PG",
                "PH",
                "PK",
                "PL",
                "PR",
                "PT",
                "PY",
                "RO",
                "RS",
                "RU",
                "RW",
                "SE",
                "SG",
                "SI",
                "SJ",
                "SK",
                "SM",
                "SR",
                "SV",
                "TN",
                "TR",
                "UA",
                "US",
                "UY",
                "VA",
                "VE",
                "VN",
                "ZA",
                "ZW"
              ]
            }
          },
          "required": [
            "countryCode"
          ]
        }
      }
    },
    {
      "id": "output",
      "type": "output",
      "configuration": {
        "schema": {
          "type": "object",
          "properties": {
            "dates": {
              "type": [
                "array",
                "boolean",
                "null",
                "number",
                "object",
                "string"
              ],
              "title": "response",
              "description": "The response from the fetch request"
            }
          }
        }
      }
    },
    {
      "id": "fetch",
      "type": "fetch",
      "configuration": {
        "method": "GET"
      }
    },
    {
      "id": "urlTemplate",
      "type": "urlTemplate",
      "configuration": {
        "template": "https://date.nager.at/api/v3/CountryInfo/{countryCode}"
      }
    }
  ]
}