{
  "title": "Accumulating Context (Python)",
  "description": "An example of a board that implements a multi-turn experience: a very simple chat bot that accumulates context of the conversations. Tell it \"I am hungry\" or something like this and then give simple replies, like \"bbq\". It should be able to infer what you're asking for based on the conversation context. All replies are pure hallucinations, but should give you a sense of how a Breadboard API endpoint for a board with cycles looks like.",
  "version": "0.0.2",
  "graphs": {},
  "nodes": [
    {
      "id": "input",
      "type": "input",
      "configuration": {
        "schema": {
          "properties": {
            "text": {
              "description": "User: type here to chat with the assistant",
              "title": "Text",
              "type": "string"
            },
            "generator": {
              "default": "text-generator.json",
              "description": "Generator: Text generator to use",
              "title": "Generator",
              "type": "string"
            }
          },
          "type": "object"
        }
      }
    },
    {
      "id": "output",
      "type": "output",
      "configuration": {
        "schema": {
          "properties": {
            "text": {
              "description": "Assistant: Assistant's response in the conversation with the user",
              "title": "Assistant",
              "type": "string"
            }
          },
          "required": [
            "text"
          ],
          "type": "object"
        }
      }
    },
    {
      "id": "generator",
      "type": "invoke",
      "configuration": {}
    },
    {
      "id": "assistant",
      "type": "promptTemplate",
      "configuration": {
        "template": "This is a conversation between a friendly assistant and their user. You are the assistant and your job is to try to be helpful, empathetic, and fun.\n{{context}}\n\n== Current Conversation\nuser: {{question}}\nassistant:",
        "context": ""
      }
    },
    {
      "id": "append-1",
      "type": "append",
      "configuration": {
        "accumulator": "\n== Conversation History"
      }
    }
  ],
  "edges": [
    {
      "from": "output",
      "to": "input",
      "out": "*",
      "in": ""
    },
    {
      "from": "generator",
      "to": "output",
      "out": "text",
      "in": "text"
    },
    {
      "from": "input",
      "to": "generator",
      "out": "generator",
      "in": "path"
    },
    {
      "from": "assistant",
      "to": "generator",
      "out": "prompt",
      "in": "text"
    },
    {
      "from": "input",
      "to": "assistant",
      "out": "text",
      "in": "question"
    },
    {
      "from": "append-1",
      "to": "assistant",
      "out": "accumulator",
      "in": "context"
    },
    {
      "from": "input",
      "to": "append-1",
      "out": "text",
      "in": "user"
    },
    {
      "from": "append-1",
      "to": "append-1",
      "out": "accumulator",
      "in": "accumulator"
    },
    {
      "from": "generator",
      "to": "append-1",
      "out": "text",
      "in": "assistant"
    }
  ],
  "kits": [
    {
      "url": "npm:annotation=NoneType required=True"
    },
    {
      "url": "npm:@google-labs/template-kit"
    },
    {
      "url": "npm:@google-labs/core-kit"
    },
    {
      "url": "npm:annotation=NoneType required=True"
    }
  ]
}