{
  "title": "Blank board",
  "description": "A blank board. Use it as a starting point for your creations.",
  "version": "0.0.1",
  "nodes": [
    {
      "type": "input",
      "id": "input",
      "configuration": {
        "schema": {
          "properties": {
            "context": {
              "type": "array",
              "title": "Context",
              "examples": [],
              "items": {
                "type": "object",
                "behavior": ["llm-content"]
              },
              "default": "[{\"role\":\"user\",\"parts\":[{\"text\":\"\"}]}]"
            }
          },
          "type": "object",
          "required": []
        }
      },
      "metadata": {
        "visual": {
          "x": 0,
          "y": 0
        }
      }
    },
    {
      "type": "output",
      "id": "output",
      "configuration": {
        "schema": {
          "properties": {
            "context": {
              "type": "array",
              "title": "Context",
              "examples": [],
              "items": {
                "type": "object",
                "behavior": ["llm-content"]
              },
              "default": "null"
            }
          },
          "type": "object",
          "required": []
        }
      },
      "metadata": {
        "visual": {
          "x": 173,
          "y": 0
        }
      }
    }
  ],
  "edges": [
    {
      "from": "input",
      "out": "context",
      "to": "output",
      "in": "context"
    }
  ]
}
