{
  "edges": [
    {
      "from": "node-b",
      "out": "text",
      "to": "node-c",
      "in": "data"
    },
    {
      "from": "node-a",
      "out": "text",
      "to": "node-d",
      "in": "data"
    }
  ],
  "nodes": [
    { "id": "node-a", "type": "input" },
    {
      "id": "node-b",
      "type": "input"
    },
    { "id": "node-c", "type": "output" },
    { "id": "node-d", "type": "output" }
  ],
  "inputs": { "text": "foo" },
  "outputs": [{ "data": "foo" }],
  "sequence": ["node-b", "node-c"],
  "start": "node-b"
}
